[
  {
    "body": "Doctor appointment",
    "date": "2026-03-25",
    "time": "09:00:00",
    "finished": false
  },
  {
    "body": "Submit project",
    "date": "2026-03-20",
    "time": "23:59:00",
    "finished": false
  },
  {
    "body": "Morning run",
    "date": "2026-03-22",
    "time": "06:00:00",
    "finished": true
  }
]